<?xml version="1.0" encoding="UTF-8"?>
<!DOCTYPE subject SYSTEM "openQuestionary.dtd">
<subject id="matematicabasica" name="matematicabasica">
	<question text="cuanto es dos m&#xE1;s dos?">
		<option answer="yes">4</option>
		<option>0</option>
		<option>5</option>
	</question>
	<question text="cuanto es tres elevado a la cuatro?">
		<option answer="yes">81</option>
		<option>27</option>
		<option>57</option>
	</question>
	<question text="cuanto es dos por dos?">
		<option answer="yes">4</option>
		<option>1</option>
		<option>2</option>
	</question>
	<question text="cuanto es dos m&#xE1;s dos?">
		<option answer="yes">4</option>
		<option>0</option>
		<option>5</option>
	</question>
</subject>